{
  "version": "repoctx.artifacts/v1alpha1",
  "namespace": "repoctx",
  "artifacts": [
    {"id":"repoctx:component.compiler","kind":"component","applies_to":[{"kind":"subtree","path":"pkg/compiler"}],"lifecycle":"active","sources":[{"path":"pkg/compiler/compiler.go","sha256":"ea840dfb21b9c12a7fa69a51e07c91e549c7362005b3c4f8e6d0ec9e409ffd5d","start_byte":0,"end_byte":16,"start_line":1,"end_line":1,"start_byte_column":0,"end_byte_column":16}],"declared_inputs":[{"path":"go.mod","role":"configuration","required":true}]},
    {"id":"repoctx:component.agent-context","kind":"component","applies_to":[{"kind":"subtree","path":"pkg/agentctx"}],"lifecycle":"active","sources":[{"path":"pkg/agentctx/types.go","sha256":"a827eccff9fafbf3d6df7784ac4c70bcb159c0307df3f3f9fa7db44f8705cf8c","start_byte":0,"end_byte":252,"start_line":1,"end_line":4,"start_byte_column":0,"end_byte_column":16}],"declared_inputs":[{"path":"go.mod","role":"configuration","required":true}]},
    {"id":"repoctx:component.discovery","kind":"component","applies_to":[{"kind":"subtree","path":"pkg/discovery"}],"lifecycle":"active","sources":[{"path":"pkg/discovery/types.go","sha256":"6f44ae9ff8d8df933a3e40c416b8564d3472d86e2dec50bacc24d39653c8e7c6","start_byte":0,"end_byte":171,"start_line":1,"end_line":3,"start_byte_column":0,"end_byte_column":17}],"declared_inputs":[{"path":"go.mod","role":"configuration","required":true}]},
    {"id":"repoctx:component.artifacts","kind":"component","applies_to":[{"kind":"subtree","path":"pkg/artifacts"}],"lifecycle":"active","sources":[{"path":"pkg/artifacts/types.go","sha256":"7b9f6ac5b18094784e115f384b2ff4f7ba51d9718dcb05bf07499a08cf67ecbc","start_byte":0,"end_byte":324,"start_line":1,"end_line":5,"start_byte_column":0,"end_byte_column":17}],"declared_inputs":[{"path":"go.mod","role":"configuration","required":true}]},
    {"id":"repoctx:component.obligation-handoff","kind":"component","applies_to":[{"kind":"subtree","path":"pkg/obligation"}],"lifecycle":"active","sources":[{"path":"pkg/obligation/types.go","sha256":"0f316b0a5612c2beb206481496ddf533f604d2194fbf149c6ae8be95fd697e2e","start_byte":0,"end_byte":164,"start_line":1,"end_line":3,"start_byte_column":0,"end_byte_column":18}],"declared_inputs":[{"path":"go.mod","role":"configuration","required":true}]},
    {"id":"repoctx:contract.ir-v1alpha4","kind":"contract","applies_to":[{"kind":"subtree","path":"pkg/compiler"}],"lifecycle":"active","sources":[{"path":"docs/IR.md","sha256":"75dbd7631a0eec218698d2a9f7a7702cd3d719b5e63d46cee47487e9f1c836bf","start_byte":0,"end_byte":175,"start_line":1,"end_line":4,"start_byte_column":0,"end_byte_column":68}],"declared_inputs":[]},
    {"id":"repoctx:contract.context-v1alpha3","kind":"contract","applies_to":[{"kind":"subtree","path":"pkg/agentctx"}],"lifecycle":"active","sources":[{"path":"docs/AGENT_CONTEXT.md","sha256":"7b8c27d22346b024bd4faaccf6aafbaadf868759d54c3b4db3ffa6b866570e9c","start_byte":0,"end_byte":263,"start_line":1,"end_line":7,"start_byte_column":0,"end_byte_column":56}],"declared_inputs":[]},
    {"id":"repoctx:contract.discovery-v1alpha1","kind":"contract","applies_to":[{"kind":"subtree","path":"pkg/discovery"}],"lifecycle":"active","sources":[{"path":"docs/discovery.schema.json","sha256":"5a4a6900c7328844bef443518241e9950c46172875f6828bea5dae77eb0e487f","start_byte":140,"end_byte":193,"start_line":4,"end_line":4,"start_byte_column":2,"end_byte_column":55}],"declared_inputs":[]},
    {"id":"repoctx:contract.artifacts-v1alpha1","kind":"contract","applies_to":[{"kind":"subtree","path":"pkg/artifacts"}],"lifecycle":"active","sources":[{"path":"docs/ARTIFACTS.md","sha256":"c690c2582ec0635d86538fdea78884534edac7af4f1aae84d3ec3d93fa7bcee4","start_byte":0,"end_byte":420,"start_line":1,"end_line":7,"start_byte_column":0,"end_byte_column":76}],"declared_inputs":[]},
    {"id":"repoctx:contract.obligations-v1alpha1","kind":"contract","applies_to":[{"kind":"subtree","path":"pkg/obligation"}],"lifecycle":"active","sources":[{"path":"docs/obligations.schema.json","sha256":"7e1903ad68cb1fa5d9c27bf5d04c540e658d03f11437b139127d88c1b7f9ba1c","start_byte":142,"end_byte":188,"start_line":4,"end_line":4,"start_byte_column":2,"end_byte_column":48}],"declared_inputs":[]},
    {"id":"repoctx:requirement.development-verification","kind":"requirement","applies_to":[{"kind":"subtree","path":"."}],"lifecycle":"active","sources":[{"path":"README.md","sha256":"36f1cb00e08feaa75c19e2f4cedccb9d6fc4726ef47cb87ee40b5b2635565dea","start_byte":1070,"end_byte":1181,"start_line":19,"end_line":25,"start_byte_column":0,"end_byte_column":37}],"declared_inputs":[{"path":"go.mod","role":"configuration","required":true}]},
    {"id":"repoctx:check.go-test-all","kind":"verification_obligation","applies_to":[{"kind":"subtree","path":"."}],"lifecycle":"active","sources":[{"path":"README.md","sha256":"36f1cb00e08feaa75c19e2f4cedccb9d6fc4726ef47cb87ee40b5b2635565dea","start_byte":1070,"end_byte":1181,"start_line":19,"end_line":25,"start_byte_column":0,"end_byte_column":37}],"declared_inputs":[{"path":"go.mod","role":"configuration","required":true}],"runner_check_id":"go-test-all"},
    {"id":"repoctx:check.go-vet-all","kind":"verification_obligation","applies_to":[{"kind":"subtree","path":"."}],"lifecycle":"active","sources":[{"path":"README.md","sha256":"36f1cb00e08feaa75c19e2f4cedccb9d6fc4726ef47cb87ee40b5b2635565dea","start_byte":1070,"end_byte":1181,"start_line":19,"end_line":25,"start_byte_column":0,"end_byte_column":37}],"declared_inputs":[{"path":"go.mod","role":"configuration","required":true}],"runner_check_id":"go-vet-all"},
    {"id":"repoctx:milestone.m4-evaluation","kind":"component","applies_to":[{"kind":"file","path":"ROADMAP.md"}],"lifecycle":"active","sources":[{"path":"ROADMAP.md","sha256":"9096da07570cc53aa65354926640db506085385468a7681d548857fe4833a669","start_byte":22603,"end_byte":22798,"start_line":381,"end_line":384,"start_byte_column":0,"end_byte_column":51}],"declared_inputs":[]},
    {"id":"repoctx:requirement.m4-08-persisted-evidence-evaluation","kind":"requirement","applies_to":[{"kind":"file","path":"ROADMAP.md"}],"lifecycle":"active","sources":[{"path":"ROADMAP.md","sha256":"9096da07570cc53aa65354926640db506085385468a7681d548857fe4833a669","start_byte":27453,"end_byte":28203,"start_line":452,"end_line":461,"start_byte_column":0,"end_byte_column":39}],"declared_inputs":[]}
  ],
  "relationships": [
    {"from":"repoctx:component.compiler","to":"repoctx:contract.ir-v1alpha4","kind":"governed_by","resolution":"declared","sources":[{"path":"docs/IR.md","sha256":"75dbd7631a0eec218698d2a9f7a7702cd3d719b5e63d46cee47487e9f1c836bf","start_byte":0,"end_byte":175,"start_line":1,"end_line":4,"start_byte_column":0,"end_byte_column":68}]},
    {"from":"repoctx:component.agent-context","to":"repoctx:contract.context-v1alpha3","kind":"governed_by","resolution":"declared","sources":[{"path":"docs/AGENT_CONTEXT.md","sha256":"7b8c27d22346b024bd4faaccf6aafbaadf868759d54c3b4db3ffa6b866570e9c","start_byte":0,"end_byte":263,"start_line":1,"end_line":7,"start_byte_column":0,"end_byte_column":56}]},
    {"from":"repoctx:component.discovery","to":"repoctx:contract.discovery-v1alpha1","kind":"governed_by","resolution":"declared","sources":[{"path":"docs/discovery.schema.json","sha256":"5a4a6900c7328844bef443518241e9950c46172875f6828bea5dae77eb0e487f","start_byte":140,"end_byte":193,"start_line":4,"end_line":4,"start_byte_column":2,"end_byte_column":55}]},
    {"from":"repoctx:component.artifacts","to":"repoctx:contract.artifacts-v1alpha1","kind":"governed_by","resolution":"declared","sources":[{"path":"docs/ARTIFACTS.md","sha256":"c690c2582ec0635d86538fdea78884534edac7af4f1aae84d3ec3d93fa7bcee4","start_byte":0,"end_byte":420,"start_line":1,"end_line":7,"start_byte_column":0,"end_byte_column":76}]},
    {"from":"repoctx:component.obligation-handoff","to":"repoctx:contract.obligations-v1alpha1","kind":"governed_by","resolution":"declared","sources":[{"path":"docs/obligations.schema.json","sha256":"7e1903ad68cb1fa5d9c27bf5d04c540e658d03f11437b139127d88c1b7f9ba1c","start_byte":142,"end_byte":188,"start_line":4,"end_line":4,"start_byte_column":2,"end_byte_column":48}]},
    {"from":"repoctx:check.go-test-all","to":"repoctx:requirement.development-verification","kind":"verifies","resolution":"declared","sources":[{"path":"README.md","sha256":"36f1cb00e08feaa75c19e2f4cedccb9d6fc4726ef47cb87ee40b5b2635565dea","start_byte":1070,"end_byte":1181,"start_line":19,"end_line":25,"start_byte_column":0,"end_byte_column":37}]},
    {"from":"repoctx:check.go-vet-all","to":"repoctx:requirement.development-verification","kind":"verifies","resolution":"declared","sources":[{"path":"README.md","sha256":"36f1cb00e08feaa75c19e2f4cedccb9d6fc4726ef47cb87ee40b5b2635565dea","start_byte":1070,"end_byte":1181,"start_line":19,"end_line":25,"start_byte_column":0,"end_byte_column":37}]},
    {"from":"repoctx:milestone.m4-evaluation","to":"repoctx:requirement.m4-08-persisted-evidence-evaluation","kind":"contains","resolution":"declared","sources":[{"path":"ROADMAP.md","sha256":"9096da07570cc53aa65354926640db506085385468a7681d548857fe4833a669","start_byte":27453,"end_byte":28203,"start_line":452,"end_line":461,"start_byte_column":0,"end_byte_column":39}]}
  ]
}
